{
  "asset": {
    "asset_id": "esfera-mecanica",
    "category": "prop_grande",
    "construction_profile": "mechanical",
    "family": "mechanical",
    "geometry_outcome": "repair"
  },
  "audit": {
    "excluded": [
      "uv_layout",
      "textures",
      "materials",
      "appearance",
      "emission"
    ],
    "name": "astrion_geometry",
    "result": "waived",
    "scope": "geometry_only",
    "tool_version": "astrion-geometry-audit/0.1",
    "version": "0.1"
  },
  "camera": {
    "azimuth_degrees": 25.0,
    "declared_screen_size_world_units": 165.8,
    "elevation_degrees": 45.0,
    "pixels_per_world_unit_1440p_zoom1": 1.544297,
    "profile": "top_down_default_v1",
    "projected_height_px": 256.0,
    "projected_union_area_px2": 51551,
    "projected_width_px": 255.16,
    "raster_resolution_px": 260,
    "runtime_scale_from_glb_footprint": 79.439436009,
    "triangles_per_1000_projected_px2": 80.81
  },
  "checks": [
    {
      "actual": 4166,
      "expected": "<= 5000",
      "id": "triangle_ceiling",
      "status": "pass"
    },
    {
      "actual": 4166,
      "evidence": "A soft target is not a minimum or a gate; review the overage at gameplay size.",
      "expected": "planning target <= 4000",
      "id": "triangle_soft_target",
      "status": "warning"
    },
    {
      "actual": {
        "spec_ceiling": 5000,
        "spec_soft_target": 4000
      },
      "evidence": "The explicit reviewed spec controls this audit; the older category range is reported as a policy conflict.",
      "expected": {
        "legacy_range": [
          800,
          2500
        ]
      },
      "id": "legacy_category_triangle_policy",
      "status": "warning"
    },
    {
      "actual": 80.81,
      "expected": "preferred <= 800.0",
      "id": "gameplay_triangle_density",
      "status": "pass"
    },
    {
      "actual": 0,
      "expected": 0,
      "id": "degenerate_triangles",
      "status": "pass"
    },
    {
      "actual": 0,
      "expected": 0,
      "id": "duplicate_faces",
      "status": "pass"
    },
    {
      "actual": 0,
      "expected": 0,
      "id": "nonmanifold_edges",
      "status": "pass"
    },
    {
      "actual": 0,
      "expected": 0,
      "id": "unused_vertices",
      "status": "pass"
    },
    {
      "actual": 0,
      "expected": 0,
      "id": "boundary_edges",
      "status": "pass"
    },
    {
      "actual": 0,
      "expected": 0,
      "id": "zero_thickness_islands",
      "status": "pass"
    },
    {
      "actual": true,
      "expected": true,
      "id": "explicit_normals",
      "status": "pass"
    },
    {
      "actual": true,
      "expected": true,
      "id": "authoritative_source_exists",
      "status": "pass"
    },
    {
      "actual": 0,
      "evidence": "Verified by hash-bound Blender repair report: astrion-3d-pipeline/work/esfera-mecanica-m4-run-v1/stages/01-repair/repair-report.json",
      "expected": "0 in authoritative Blender source",
      "id": "authoritative_source_ngons",
      "status": "pass"
    },
    {
      "actual": 8,
      "expected": "8..8",
      "id": "semantic_component_count",
      "status": "pass"
    },
    {
      "actual": [],
      "expected": [],
      "id": "required_semantic_components",
      "status": "pass"
    },
    {
      "actual": [],
      "expected": [],
      "id": "unique_semantic_component_names",
      "status": "pass"
    },
    {
      "actual": [],
      "expected": [],
      "id": "required_anchors",
      "status": "pass"
    },
    {
      "actual": [],
      "expected": [],
      "id": "anchor_nodes_have_no_mesh",
      "status": "pass"
    },
    {
      "actual": [],
      "expected": [],
      "id": "unique_anchor_names",
      "status": "pass"
    },
    {
      "actual": 0,
      "evidence": "Metrics use world-space vertices after inherited GLB matrix/TRS transforms.",
      "expected": "all active-scene node transforms evaluated",
      "id": "node_transforms_applied",
      "status": "pass"
    },
    {
      "actual": 165.8,
      "expected": 165.8,
      "id": "runtime_screen_size",
      "status": "pass"
    },
    {
      "actual": 0.001233,
      "expected": "<= 0.05 of bounding-box diagonal",
      "id": "centered_origin",
      "status": "pass"
    },
    {
      "actual": 1.0062,
      "expected": "not declared by this spec",
      "id": "class_flatness",
      "status": "informational"
    },
    {
      "actual": 0,
      "evidence": "The whole-mesh point-set probe is evidence only; confirm staggered/partial radial intent visually.",
      "expected": "multiple of 6",
      "id": "declared_radial_symmetry",
      "status": "warning"
    },
    {
      "actual": [
        {
          "island": 11,
          "rot_order": 33
        }
      ],
      "evidence": "Automatic primitive classification is advisory; review the named components before changing geometry.",
      "expected": "<= 24",
      "id": "mechanical_rotational_segments",
      "status": "warning"
    },
    {
      "actual": [],
      "expected": [],
      "id": "thin_geometry",
      "status": "pass"
    },
    {
      "actual": 0.255,
      "expected": "<= 0.05 unless declared FX/exception",
      "id": "never_visible_geometry",
      "status": "waived",
      "waiver": {
        "check_id": "never_visible_geometry",
        "expires": null,
        "reason": "The raised armor plates and core rings are intentionally closed semantic solids whose buried bases overlap Sphere_Core; deleting them would open the pieces or require a Boolean union that destroys the eight-component ownership contract.",
        "reviewer": "Repository owner, authorized in the Codex task on 2026-09-04",
        "revisit_condition": "Reopen if geometry/component topology, animation exposure, gameplay camera, declared screen size, or production status changes.",
        "scope": "Only the 25.5% never-visible ratio measured for the hash-bound 4,166-triangle esfera-mecanica repaired Master Mesh at top_down_default_v1 and 165.8 world units."
      }
    },
    {
      "actual": 0.041,
      "expected": "preferred <= 0.10",
      "id": "subpixel_triangles",
      "status": "pass"
    },
    {
      "actual": "required",
      "evidence": "Automated metrics and the diagnostic image are evidence, not visual approval.",
      "expected": "human review of silhouette, major masses, and identity features",
      "id": "gameplay_visual_review",
      "status": "warning"
    },
    {
      "actual": [],
      "expected": [],
      "id": "declared_astrion_sources_exist",
      "status": "pass"
    },
    {
      "actual": "repair",
      "expected": "decided geometry outcome",
      "id": "geometry_origin_consistency",
      "status": "pass"
    }
  ],
  "diagnostics": {
    "gameplay_silhouette": {
      "gameplay_projected_span_px": 256,
      "hidden_triangles_this_view": 2884,
      "inspection_resolution_px": 560,
      "path": "astrion-3d-pipeline/work/esfera-mecanica-m4-run-v1/stages/02-audit1/diagnostics/silhouette-esfera-mecanica.png",
      "silhouette_triangles": 89,
      "visible_triangles": 1282
    }
  },
  "inputs": {
    "authoritative_source_path": "astrion-3d-pipeline/work/esfera-mecanica-m4-run-v1/stages/01-repair/esfera-mecanica-repaired.blend",
    "authoritative_source_sha256": "d57aa38dd3d746952b3b0d8be54ab33ceb12faac0659e5103ab0b558d9143342",
    "authoritative_source_topology_evidence": {
      "blender_version": "5.2.1 LTS",
      "path": "astrion-3d-pipeline/work/esfera-mecanica-m4-run-v1/stages/01-repair/repair-report.json",
      "residual_ngons": 0,
      "sha256": "52bd7fe1f18ce14d108d1b0765b0fad9ed81061aae8f60f630cb290afe5ec81f",
      "tool": "astrion-repair-esfera-mecanica/0.1"
    },
    "declared_provenance": {
      "base_spec": "esfera-mecanica",
      "m4_runner": "astrion-m4-esfera-runner/0.1",
      "repair_report": "astrion-3d-pipeline/work/esfera-mecanica-m4-run-v1/stages/01-repair/repair-report.json",
      "source_asset_unchanged": true
    },
    "declared_source_inputs": [
      {
        "authority": "astrion_source",
        "exists": true,
        "path": "tools/esfera-mecanica.py",
        "role": "procedural_builder",
        "sha256": "20d8f3206c3c0ff48621f2841c66e22858d95297ebfad1bb2cc6de34712681c6"
      },
      {
        "authority": "astrion_source",
        "exists": true,
        "path": "tools/reparar-esfera-mecanica.py",
        "role": "deterministic_geometry_repair",
        "sha256": "5100270428b0470403edddf66c399f6bdd5bfa92f27f3e2071429931ea256686"
      },
      {
        "authority": "astrion_source",
        "exists": true,
        "path": "tools/esfera-mecanica-uv.py",
        "role": "authoritative_uv_material_emission_preparation",
        "sha256": "81b66af36cc9461cd27b95acb0a92a8fa7307dd5625c89718be5c2e809c3446b"
      },
      {
        "authority": "astrion_source",
        "exists": true,
        "path": "tools/reproyectar-texturas.py",
        "role": "appearance_reprojection",
        "sha256": "3915b576e46a53ffe8d73e023ec03dce52aa762bb653162cc04efa43ef1f9b19"
      },
      {
        "authority": "astrion_source",
        "exists": true,
        "path": "astrion-3d-pipeline/tools/audit_m3_esfera.py",
        "role": "m3_audit_2_recorder",
        "sha256": "4cad13248bce6bf32701059092009d2e0a14f27c2a1669a7d4a365bdf9938e24"
      }
    ],
    "model_path": "astrion-3d-pipeline/work/esfera-mecanica-m4-run-v1/stages/01-repair/esfera-mecanica-repaired.glb",
    "model_sha256": "2a25a99667ccbb1cc64fa0d18daf73f802d9d23346fa7ac5c79264583022dd6c",
    "spec_path": "astrion-3d-pipeline/work/esfera-mecanica-m4-run-v1/stages/02-audit1/asset-spec.audit1-input.json",
    "spec_sha256": "c76114d05e51114c8135591f8447dde965667b46867daedee59b7c502ffe95a5"
  },
  "islands": [
    {
      "aspect": 1.0,
      "boundary_edges": 0,
      "closed": true,
      "diag": 275.186,
      "flat_card": false,
      "island": 11,
      "median_valence": 6,
      "radial_slots": 32,